{
  "id": "P0.006",
  "spec": "Make mountain bodies continuous solid regions rather than sparse visual rock decoration [P2]",
  "doneWhen": "Across deterministic RNG seeds 1234567, 1, and 42, mountain interior non-solid count === 0, flat valley solid count === 0, HQ connectivity passes 3/3, and production elevation/ramp sha256 remains a731b52ecfed451f8d965f21e791d19a254b3ae30e790d55e143b5fa281d779f",
  "files": [
    "src2/scenes/BattleScene.js",
    "scripts/verify-mountain-continuity.cjs",
    "terrain_truth.json"
  ],
  "signatures": [
    "BattleScene.buildMountains",
    "BattleScene.exportTerrainTruth",
    "BattleScene.rng"
  ],
  "failingTest": "fixtures/failing-p0006-mountain-continuity.txt",
  "testCommand": "node scripts/verify-mountain-continuity.cjs",
  "deps": [
    "P0.005"
  ],
  "diffCap": 400,
  "forbiddenScope": [
    "Do not alter elevation or ramp generation/masks",
    "do not implement P0.007 ramp work",
    "do not change public RNG semantics or add production seed controls",
    "do not modify other source, existing tests/verifiers, images, planning docs except ticket state, config, git, or external systems"
  ]
}
